number,value,datetime_start,datetime_complete,duration,params_centroid_method,params_centroid_threshold,params_flag_condition,params_icp_max_correspondence_dist,params_point_threshold,state
0,0.35017562820859227,2026-05-25 16:23:18.564444,2026-05-25 16:45:16.803126,0 days 00:21:58.238682,linear_velocity,0.7587945476302645,or,0.2403950683025824,0.04277839467700388,COMPLETE
1,0.056265984654731455,2026-05-25 16:45:16.902931,2026-05-25 17:07:19.187995,0 days 00:22:02.285064,first_diff,0.737265320016441,and,0.8491983767203796,0.07671460434922076,COMPLETE
2,0.3037037037037037,2026-05-25 17:07:19.247033,2026-05-25 17:28:42.322978,0 days 00:21:23.075945,linear_velocity,0.373818018663584,or,0.36210622617823773,0.1646076368389235,COMPLETE
3,0.33182503770739064,2026-05-25 17:28:42.375654,2026-05-25 17:50:24.398510,0 days 00:21:42.022856,first_diff,0.4297256589643226,or,0.2797064039425238,0.14313157645099456,COMPLETE
4,0.0,2026-05-25 17:50:24.454463,2026-05-25 18:13:52.599466,0 days 00:23:28.145003,linear_velocity,0.6467903667112945,and,0.9539969835279999,0.24243904727640306,COMPLETE
5,0.0,2026-05-25 18:13:52.655194,2026-05-25 18:34:29.354759,0 days 00:20:36.699565,linear_velocity,0.1879049026057455,and,0.20983441136030095,0.13893892022447946,COMPLETE
6,0.33946078431372545,2026-05-25 18:34:29.409689,2026-05-25 18:57:14.819029,0 days 00:22:45.409340,linear_velocity,0.3329019834400152,or,0.5680612190600297,0.15027626145552153,COMPLETE
7,0.16592328278322926,2026-05-25 18:57:14.875953,2026-05-25 19:20:23.592903,0 days 00:23:08.716950,linear_velocity,0.7976195410250031,or,0.6381099809299766,0.2328123317050857,COMPLETE
8,0.3453429410194822,2026-05-25 19:20:23.652217,2026-05-25 19:41:05.366985,0 days 00:20:41.714768,first_diff,0.14070456001948428,or,0.34421412859650635,0.21232225201342445,COMPLETE
9,0.0,2026-05-25 19:41:05.418380,2026-05-25 20:01:07.478871,0 days 00:20:02.060491,first_diff,0.5884264748424236,and,0.16709557931179375,0.2471151260521138,COMPLETE
10,0.3452317527970165,2026-05-25 20:01:07.530554,2026-05-25 20:22:54.320782,0 days 00:21:46.790228,linear_velocity,0.9177281431482983,or,0.48635519389748166,0.03319597962643942,COMPLETE
11,0.34550786456944815,2026-05-25 20:22:54.372823,2026-05-25 20:45:05.798700,0 days 00:22:11.425877,first_diff,0.11403531969261055,or,0.40131565860091256,0.1924492198395046,COMPLETE
12,0.3284883720930233,2026-05-25 20:45:05.848740,2026-05-25 21:06:36.191343,0 days 00:21:30.342603,first_diff,0.9512287479763418,or,0.4403880175609497,0.08769970333893784,COMPLETE
13,0.3163082437275986,2026-05-25 21:06:36.244858,2026-05-25 21:25:49.900568,0 days 00:19:13.655710,first_diff,0.48440107506999863,or,0.10647544009320883,0.19135089852508966,COMPLETE
14,0.33971690258118237,2026-05-25 21:25:49.952505,2026-05-25 21:48:44.290890,0 days 00:22:54.338385,linear_velocity,0.7801136990965511,or,0.6874130802024829,0.10647935470924821,COMPLETE
15,0.3452317527970165,2026-05-25 21:48:44.342899,2026-05-25 22:10:05.181906,0 days 00:21:20.839007,first_diff,0.28728650115512633,or,0.2687793682900306,0.030650294872240406,COMPLETE
16,0.09171974522292992,2026-05-25 22:10:05.231860,2026-05-25 22:31:52.892473,0 days 00:21:47.660613,linear_velocity,0.6308187217079619,or,0.4178489758823907,0.18868396195249945,COMPLETE
17,0.34598930481283424,2026-05-25 22:31:52.941892,2026-05-25 22:54:29.040054,0 days 00:22:36.098162,first_diff,0.2417681571418503,or,0.7499839677311977,0.11315938065405924,COMPLETE
18,0.3642752562225475,2026-05-25 22:54:29.088200,2026-05-25 23:17:16.681545,0 days 00:22:47.593345,first_diff,0.23274472163499688,and,0.8109691196781996,0.063478537543871,COMPLETE
19,0.0,2026-05-25 23:17:16.781488,2026-05-25 23:40:39.917487,0 days 00:23:23.135999,linear_velocity,0.8634995942730335,and,0.8244545439317669,0.060708854006431175,COMPLETE
20,0.2934963868816009,2026-05-25 23:40:39.973020,2026-05-26 00:03:40.043264,0 days 00:23:00.070244,first_diff,0.5117073563055857,and,0.9795398190355702,0.05089399461242737,COMPLETE
21,0.33368606701940035,2026-05-26 00:03:40.106202,2026-05-26 00:26:33.315972,0 days 00:22:53.209770,first_diff,0.24933225161231487,and,0.7493229922289033,0.11192328338934382,COMPLETE
22,0.3440929632020659,2026-05-26 00:26:33.376828,2026-05-26 00:49:13.220126,0 days 00:22:39.843298,first_diff,0.23102272402000645,and,0.8458307192998445,0.10277704316660066,COMPLETE
23,0.3540903540903541,2026-05-26 00:49:13.284387,2026-05-26 01:12:00.684442,0 days 00:22:47.400055,first_diff,0.3703273297544374,and,0.5797464257392546,0.06609221791499056,COMPLETE
24,0.34332191780821913,2026-05-26 01:12:00.744374,2026-05-26 01:34:41.808591,0 days 00:22:41.064217,first_diff,0.397044291410941,and,0.5436011146192912,0.06148202850548658,COMPLETE
25,0.3163383545770567,2026-05-26 01:34:41.871822,2026-05-26 01:58:26.151316,0 days 00:23:44.279494,first_diff,0.4640527821504604,and,0.611874046171671,0.08041422897631201,COMPLETE
26,0.31759656652360513,2026-05-26 01:58:26.215382,2026-05-26 02:21:21.973471,0 days 00:22:55.758089,linear_velocity,0.3410189898871521,and,0.5213563818347731,0.04550833883164463,COMPLETE
27,0.12148481439820022,2026-05-26 02:21:22.042825,2026-05-26 02:44:35.573407,0 days 00:23:13.530582,first_diff,0.6859279552317308,and,0.7018325631547706,0.067701059103208,COMPLETE
28,0.0625,2026-05-26 02:44:35.630512,2026-05-26 03:09:11.726764,0 days 00:24:36.096252,linear_velocity,0.5660356488988222,and,0.8898181460838562,0.09325924897599722,COMPLETE
29,0.025174825174825173,2026-05-26 03:09:11.792333,2026-05-26 03:33:37.017360,0 days 00:24:25.225027,first_diff,0.7282869760048611,and,0.8070450051301004,0.12644084987948168,COMPLETE
30,0.3798219584569733,2026-05-26 03:33:37.080649,2026-05-26 03:57:46.898929,0 days 00:24:09.818280,first_diff,0.3237280960446476,and,0.6170334434639358,0.07201929938962984,COMPLETE
31,0.37455830388692574,2026-05-26 03:57:47.005771,2026-05-26 04:21:44.933091,0 days 00:23:57.927320,first_diff,0.2909915357605425,and,0.6018257633102243,0.07460571755188959,COMPLETE
32,0.37964633706243234,2026-05-26 04:21:44.993895,2026-05-26 04:46:13.993230,0 days 00:24:28.999335,first_diff,0.30473763656361547,and,0.6332845544892423,0.07285027850741792,COMPLETE
33,0.37702607470049326,2026-05-26 04:46:14.057452,2026-05-26 05:11:06.642892,0 days 00:24:52.585440,first_diff,0.2928481756301187,and,0.6574818175854531,0.07423672934454231,COMPLETE
34,0.3803636363636363,2026-05-26 05:11:06.705545,2026-05-26 05:34:55.782223,0 days 00:23:49.076678,first_diff,0.2975865043481447,and,0.6594508882085085,0.08091062844152336,COMPLETE
35,0.32995194874532835,2026-05-26 05:34:55.893131,2026-05-26 05:58:47.267865,0 days 00:23:51.374734,first_diff,0.42841174146873556,and,0.6654385598213154,0.09186996011619779,COMPLETE
36,0.3506849315068493,2026-05-26 05:58:47.327269,2026-05-26 06:23:36.382641,0 days 00:24:49.055372,first_diff,0.15309459434332295,and,0.7190554319107728,0.0457428165281947,COMPLETE
37,0.24556616643929055,2026-05-26 06:23:36.447323,2026-05-26 06:46:57.467402,0 days 00:23:21.020079,first_diff,0.33123179217556964,and,0.4929487826052609,0.12685367563522143,COMPLETE
38,0.3651767455448437,2026-05-26 06:46:57.530983,2026-05-26 07:10:43.029852,0 days 00:23:45.498869,first_diff,0.18154719169209235,and,0.6523225042109665,0.08286662247089918,COMPLETE
39,0.3728370878223964,2026-05-26 07:10:43.088473,2026-05-26 07:34:38.450824,0 days 00:23:55.362351,first_diff,0.3022836269765662,and,0.7578998707846141,0.05428044218172555,COMPLETE
40,0.31920460491889063,2026-05-26 07:34:38.509551,2026-05-26 07:58:32.555796,0 days 00:23:54.046245,first_diff,0.40414896458693395,and,0.6188325292806354,0.09852760300466899,COMPLETE
41,0.37873754152823924,2026-05-26 07:58:32.608769,2026-05-26 08:22:06.019998,0 days 00:23:33.411229,first_diff,0.30706130758627237,and,0.5833372542938875,0.07562215971016209,COMPLETE
42,0.3658536585365854,2026-05-26 08:22:06.070420,2026-05-26 08:45:31.591139,0 days 00:23:25.520719,first_diff,0.35793427130380046,and,0.5478830660880888,0.0779434649688607,COMPLETE
43,0.267005076142132,2026-05-26 08:45:31.641438,2026-05-26 09:08:29.043966,0 days 00:22:57.402528,first_diff,0.21113095328685771,and,0.4709411593056705,0.12392866751858081,COMPLETE
44,0.3794658342004855,2026-05-26 09:08:29.094255,2026-05-26 09:32:56.642678,0 days 00:24:27.548423,first_diff,0.2871226062860317,and,0.6464968367972891,0.07485292631852795,COMPLETE
45,0.27013422818791943,2026-05-26 09:32:56.699822,2026-05-26 09:57:01.189371,0 days 00:24:04.489549,first_diff,0.1033011025505359,and,0.586685470940387,0.15981123750394283,COMPLETE
46,0.2987212276214834,2026-05-26 09:57:01.263727,2026-05-26 10:19:41.399478,0 days 00:22:40.135751,first_diff,0.45947807937213475,and,0.3426785665254987,0.040673384762223444,COMPLETE
47,0.35819142689371697,2026-05-26 10:19:41.459838,2026-05-26 10:42:03.531433,0 days 00:22:22.071595,first_diff,0.16979992326611665,and,0.7003595254646509,0.0925313501671154,COMPLETE
48,0.3649732620320856,2026-05-26 10:42:03.591885,2026-05-26 11:00:17.734526,0 days 00:18:14.142641,first_diff,0.2696222854805028,and,0.5182729745651135,0.05491793695341053,COMPLETE
49,0.174573055028463,2026-05-26 11:00:17.797941,2026-05-26 11:18:06.472046,0 days 00:17:48.674105,first_diff,0.5291844544528383,and,0.7758671646061159,0.13728645679911267,COMPLETE
