number,value,datetime_start,datetime_complete,duration,params_centroid_method,params_centroid_threshold,params_cluster_on_bev,params_dbscan_eps_3d,params_dbscan_eps_bev,params_dbscan_min_samples,params_flag_condition,params_min_frames_associated,params_motion_tolerance,params_point_threshold,params_temporal_window,state
100,0.2948885976408912,2026-05-25 13:33:48.196391,2026-05-25 13:57:52.602185,0 days 00:24:04.405794,first_diff,0.23717305973954353,True,,0.7482868528361559,2,and,4,1.2920511168701991,0.1181390651029431,16,COMPLETE
101,0.35203094777562866,2026-05-25 13:57:52.659985,2026-05-25 14:21:56.928327,0 days 00:24:04.268342,linear_velocity,0.627701197125175,False,2.587999694432053,,6,or,4,0.8519625862774883,0.11400284967580702,15,COMPLETE
102,0.35832580548027704,2026-05-25 14:21:56.987000,2026-05-25 14:46:08.006238,0 days 00:24:11.019238,linear_velocity,0.5935845873816904,False,2.7433015165441925,,7,or,4,0.6644512414206669,0.12177471234025183,15,COMPLETE
103,0.3690402476780186,2026-05-25 14:46:08.064505,2026-05-25 15:12:49.237211,0 days 00:26:41.172706,linear_velocity,0.9963843052748864,False,2.997967866272981,,5,or,4,0.6792495575527453,0.12208381094934244,16,COMPLETE
104,0.36977392381542273,2026-05-25 15:12:49.294929,2026-05-25 15:38:51.019768,0 days 00:26:01.724839,linear_velocity,0.987418099343873,False,2.9539660073854477,,7,or,5,0.6550408526077468,0.12048450357603678,16,COMPLETE
105,0.3676092544987147,2026-05-25 15:38:51.084411,2026-05-25 16:01:40.501254,0 days 00:22:49.416843,linear_velocity,0.9657659371521038,False,2.99333077274703,,7,or,5,0.46242979954143204,0.11068869974408481,17,COMPLETE
106,0.3595667870036101,2026-05-25 16:01:40.558936,2026-05-25 16:22:12.687055,0 days 00:20:32.128119,linear_velocity,0.9587926765950489,False,2.982631305741357,,7,or,5,0.448062864667571,0.12018716068746396,16,COMPLETE
107,0.2707474985285462,2026-05-25 16:22:12.747029,2026-05-25 16:46:48.197217,0 days 00:24:35.450188,linear_velocity,0.9974791065689327,False,2.9764492677733743,,7,or,5,0.2491990610245199,0.12067404404764892,16,COMPLETE
108,0.006079027355623099,2026-05-25 16:46:48.255632,2026-05-25 17:09:15.790567,0 days 00:22:27.534935,linear_velocity,0.9721557785908901,False,2.995787869440677,,9,or,5,0.1006274960361061,0.13297462288856413,18,COMPLETE
109,0.3502658003544004,2026-05-25 17:09:15.846630,2026-05-25 17:36:47.853870,0 days 00:27:32.007240,linear_velocity,0.914325845121662,False,2.8700913848681875,,8,or,5,0.4489526818158567,0.10100125671037495,17,COMPLETE
110,0.35160905840286055,2026-05-25 17:36:47.911908,2026-05-25 18:06:55.156096,0 days 00:30:07.244188,linear_velocity,0.8762734519799801,False,2.755837561033593,,7,or,6,0.5440858357777619,0.11055597242799234,16,COMPLETE
111,0.37079731027857826,2026-05-25 18:06:55.217219,2026-05-25 18:37:27.903020,0 days 00:30:32.685801,linear_velocity,0.9599703542349254,False,2.9306231829427345,,6,or,5,0.6125299960320922,0.12160685826666737,17,COMPLETE
112,0.36845273931366646,2026-05-25 18:37:27.963323,2026-05-25 19:09:46.599760,0 days 00:32:18.636437,linear_velocity,0.9500625242699051,False,2.912121984469922,,6,or,5,0.6619822461265215,0.11732777465604119,17,COMPLETE
113,0.35498220640569395,2026-05-25 19:09:46.660588,2026-05-25 19:34:44.499474,0 days 00:24:57.838886,linear_velocity,0.9536426666874048,False,2.928726404183808,,6,or,5,0.3014300175974179,0.11674619343596657,18,COMPLETE
114,0.29843893480257117,2026-05-25 19:34:44.559012,2026-05-25 20:01:34.526563,0 days 00:26:49.967551,linear_velocity,0.9826848264150005,False,2.8228463462844338,,8,or,5,0.41364568053261197,0.14139221761243218,17,COMPLETE
115,0.3506401137980085,2026-05-25 20:01:34.583746,2026-05-25 20:31:28.234702,0 days 00:29:53.650956,linear_velocity,0.8993695741765956,False,2.9286321468406267,,7,or,5,0.5557635214221935,0.13074147664337615,17,COMPLETE
116,0.3515866329682673,2026-05-25 20:31:28.292884,2026-05-25 21:03:18.885354,0 days 00:31:50.592470,linear_velocity,0.9476591910034549,False,2.842086984131677,,6,or,5,0.6426753145647341,0.10562549524593304,18,COMPLETE
117,0.18386816999132696,2026-05-25 21:03:18.942716,2026-05-25 21:26:19.511099,0 days 00:23:00.568383,linear_velocity,0.970232174990131,False,2.9432561182552637,,5,or,5,0.21286766478746266,0.13521537504064277,16,COMPLETE
118,0.363480251860332,2026-05-25 21:26:19.578568,2026-05-25 21:59:46.815581,0 days 00:33:27.237013,linear_velocity,0.9242154275150537,False,2.8613307245138944,,6,or,6,0.7545361294046149,0.11119918678598423,17,COMPLETE
119,0.3453663793103448,2026-05-25 21:59:46.869681,2026-05-25 22:33:54.539392,0 days 00:34:07.669711,linear_velocity,0.928886725460055,False,2.8447481817154743,,8,or,6,0.786614573414875,0.09012375909511397,17,COMPLETE
120,0.3667425968109339,2026-05-25 22:33:54.594136,2026-05-25 23:00:18.890124,0 days 00:26:24.295988,linear_velocity,0.8926138822262739,False,2.9978835609929493,,9,or,6,0.3771377221669296,0.1130702511782995,17,COMPLETE
121,0.3690398432397126,2026-05-25 23:00:18.953167,2026-05-25 23:28:40.854979,0 days 00:28:21.901812,linear_velocity,0.8938874320433436,False,2.997917764764896,,9,or,6,0.4907391757878559,0.11256073697757026,18,COMPLETE
122,0.3598956824108954,2026-05-25 23:28:40.914756,2026-05-26 00:00:47.941266,0 days 00:32:07.026510,linear_velocity,0.8765842760098681,False,2.887105106804617,,10,or,6,0.6892381637227227,0.11334381716840922,19,COMPLETE
123,0.35481927710843375,2026-05-26 00:00:48.007166,2026-05-26 00:28:00.146753,0 days 00:27:12.139587,linear_velocity,0.9981842464254861,False,2.7755313241896706,,6,or,6,0.5327260949894719,0.1087557840003122,18,COMPLETE
124,0.2916067146282973,2026-05-26 00:28:00.214287,2026-05-26 00:53:36.791019,0 days 00:25:36.576732,linear_velocity,0.923994659486524,False,2.6610383280235954,,12,or,7,0.32900608691128574,0.12796257759302881,17,COMPLETE
125,0.34801762114537443,2026-05-26 00:53:36.856190,2026-05-26 01:27:39.474478,0 days 00:34:02.618288,linear_velocity,0.8996693838195299,False,2.9918946182924064,,9,or,6,0.7430869175568675,0.09636616858503612,18,COMPLETE
126,0.3676277850589777,2026-05-26 01:27:39.545063,2026-05-26 01:57:44.594205,0 days 00:30:05.049142,linear_velocity,0.8417786873661689,False,2.8816961553787808,,6,or,7,0.582351815573924,0.11606553114631972,17,COMPLETE
127,0.0,2026-05-26 01:57:44.660461,2026-05-26 02:24:03.513790,0 days 00:26:18.853329,linear_velocity,0.8608650989487588,False,2.9236047934673604,,11,and,8,0.38640555759346307,0.11645780290058272,19,COMPLETE
128,0.2035541195476575,2026-05-26 02:24:03.579957,2026-05-26 02:46:58.407785,0 days 00:22:54.827828,linear_velocity,0.8453783297435221,False,2.800517819729774,,6,or,7,0.18016893129059364,0.10324062278807368,18,COMPLETE
129,0.35012504465880673,2026-05-26 02:46:58.468781,2026-05-26 03:17:10.734383,0 days 00:30:12.265602,linear_velocity,0.836596748488206,False,2.7167481885927067,,9,or,7,0.5787374342418374,0.1289433159398376,17,COMPLETE
130,0.3128984796468858,2026-05-26 03:17:10.802159,2026-05-26 03:45:01.686149,0 days 00:27:50.883990,linear_velocity,0.889034778096466,False,2.9332971317724956,,5,or,8,0.4747477523737802,0.1367625828387551,17,COMPLETE
131,0.3558282208588957,2026-05-26 03:45:01.748471,2026-05-26 04:21:11.245126,0 days 00:36:09.496655,linear_velocity,0.9120659397200926,False,2.8765710612766844,,6,or,6,0.8265823602531333,0.10783735246629153,17,COMPLETE
132,0.3282925488039593,2026-05-26 04:21:11.312538,2026-05-26 05:02:15.095866,0 days 00:41:03.783328,linear_velocity,0.9388575294028626,False,2.8385493928366214,,20,or,6,1.0288716729602296,0.11137507192171374,17,COMPLETE
133,0.3873994638069705,2026-05-26 05:02:15.170707,2026-05-26 05:34:32.845687,0 days 00:32:17.674980,linear_velocity,0.9754845964678398,False,2.995795337088243,,6,or,7,0.6837658638777309,0.12335197621101082,17,COMPLETE
134,0.3785046728971962,2026-05-26 05:34:32.958094,2026-05-26 06:06:57.201539,0 days 00:32:24.243445,linear_velocity,0.9773010353068524,False,2.99322908314522,,8,or,7,0.6862615441762806,0.12428794387203707,16,COMPLETE
135,0.37609841827768015,2026-05-26 06:06:57.265648,2026-05-26 06:39:00.058073,0 days 00:32:02.792425,linear_velocity,0.9870747344166461,False,2.9487923267210387,,8,or,7,0.640112510615293,0.12651396411885565,16,COMPLETE
136,0.3768996960486322,2026-05-26 06:39:00.118421,2026-05-26 07:10:32.545986,0 days 00:31:32.427565,linear_velocity,0.9742185306874424,False,2.9957779713864485,,8,or,7,0.648988346666712,0.12409753114245262,16,COMPLETE
137,0.3742649602213766,2026-05-26 07:10:32.612008,2026-05-26 07:42:00.652730,0 days 00:31:28.040722,linear_velocity,0.9800167768167802,False,2.999269675668867,,8,or,7,0.637615197709997,0.12432718985090586,16,COMPLETE
138,0.3758747084305231,2026-05-26 07:42:00.706175,2026-05-26 08:13:51.691474,0 days 00:31:50.985299,linear_velocity,0.9806507165345062,False,2.9469477635468495,,8,or,7,0.6621476556666622,0.12380011946580574,16,COMPLETE
139,0.36836699760356034,2026-05-26 08:13:51.745048,2026-05-26 08:44:35.350429,0 days 00:30:43.605381,linear_velocity,0.9819570389096741,False,2.9249165683185363,,8,or,7,0.6372553281762344,0.12464493201793891,16,COMPLETE
140,0.3612948137835016,2026-05-26 08:44:35.405553,2026-05-26 09:15:05.942499,0 days 00:30:30.536946,linear_velocity,0.9779172164527807,False,2.951678148549488,,10,or,7,0.611813897567585,0.12403940806720143,16,COMPLETE
141,0.36671368124118475,2026-05-26 09:15:05.997765,2026-05-26 09:47:03.969303,0 days 00:31:57.971538,linear_velocity,0.9897642471204214,False,2.9298459051067427,,8,or,7,0.6837703170404954,0.1312040424703036,16,COMPLETE
142,0.36608609924416696,2026-05-26 09:47:04.021663,2026-05-26 10:18:32.653708,0 days 00:31:28.632045,linear_velocity,0.9589446715600055,False,2.882903163770642,,8,or,7,0.6722042135854105,0.12346663610365882,16,COMPLETE
143,0.36133960047003527,2026-05-26 10:18:32.718722,2026-05-26 10:50:36.492758,0 days 00:32:03.774036,linear_velocity,0.9806567978833113,False,2.777479066914455,,8,or,7,0.859639724876877,0.1177889706367547,16,COMPLETE
144,0.3589164785553048,2026-05-26 10:50:36.560156,2026-05-26 11:17:24.004778,0 days 00:26:47.444622,linear_velocity,0.9978661803420295,False,2.9982900479409023,,8,or,7,0.5602147709145456,0.12658423556632784,16,COMPLETE
145,0.34562545191612437,2026-05-26 11:17:24.068147,2026-05-26 11:41:54.179451,0 days 00:24:30.111304,linear_velocity,0.9422957641291347,False,2.8927620234873745,,9,or,7,0.7810209103321972,0.1395256344404095,16,COMPLETE
146,0.36784336991990507,2026-05-26 11:41:54.238134,2026-05-26 12:07:37.112252,0 days 00:25:42.874118,linear_velocity,0.9650709559747895,False,2.9442490095276295,,7,or,7,0.9373007886440434,0.11881079846336254,15,COMPLETE
147,0.36290819470117064,2026-05-26 12:07:37.217245,2026-05-26 12:34:53.283891,0 days 00:27:16.066646,linear_velocity,0.9668084668655874,False,2.9427540643492525,,10,or,8,0.9883934259875362,0.12222216999537464,15,COMPLETE
148,0.35912314635718895,2026-05-26 12:34:53.351932,2026-05-26 13:00:28.879387,0 days 00:25:35.527455,linear_velocity,0.942902238610077,False,2.739693265193358,,8,or,7,0.8745006090453931,0.13087306472750207,15,COMPLETE
149,0.0,2026-05-26 13:00:28.941967,2026-05-26 13:27:51.505152,0 days 00:27:22.563185,linear_velocity,0.9821212825215924,False,2.819960434478713,,7,and,7,1.1118376432867383,0.11886916347892175,16,COMPLETE
